business_id,name,address,city,state,latitude,longitude,review_id,user_id,date,text,adjusted_avg_rating,adjusted_rating,sentiment,adjusted_review_count
ZD4pn3wsNh1EnXF3GuNQEg,Chicken Holiday,1865 N Olden Avenue Ext,Trenton,NJ,40.249878572,-74.7781056482,QneiL6BqO4cdsb0fFDk2bg,yCmqIL_J93vjQzdl2eR5_g,2018-08-03 12:25:58,Nope. Nope. and Nope. Asked for a suggestion and was told I could do no wrong. So I went with the flounder. It was frozen and ordered in bulk and then deep fried. I should have guessed it would be but it was my fault for not asking. Or maybe I should have just gone with the chicken. Regardless...nope. I won't be back.,3.6692307692307695,1.0,negative,13
ZD4pn3wsNh1EnXF3GuNQEg,Chicken Holiday,1865 N Olden Avenue Ext,Trenton,NJ,40.249878572,-74.7781056482,s5g8AwUVYKS7saSrSwj-nA,VCJ3L3h0tiUGbDJt6DL6Jg,2019-10-03 03:40:08,The chicken is amazing and the tender ribs been going there for over 30 years  Jimmy and his brother John still there all those years.,3.6692307692307695,5.0,positive,13
ZD4pn3wsNh1EnXF3GuNQEg,Chicken Holiday,1865 N Olden Avenue Ext,Trenton,NJ,40.249878572,-74.7781056482,G1GhWHJaU9pVCmwieD6NSg,IO0KxjZ5hUGqS5mbEC2d2w,2019-10-04 01:01:27,"Look I am from the south. I know good fried chicken. Friends let me tell you, this fried chicken is legit. The crispy coating is something to admire. It is flavorful and fresh. I can't believe I'm going home to Georgia and telling people that I had some of the best fried chicken ever, in New Jersey. The owner is also very entertaining. Great food and great atmosphere.",3.6692307692307695,5.0,positive,13
ZD4pn3wsNh1EnXF3GuNQEg,Chicken Holiday,1865 N Olden Avenue Ext,Trenton,NJ,40.249878572,-74.7781056482,CB0-MZXyBBRjq9biDZ_eVQ,ET-cu2F1x9p3KvNPg8sgGg,2019-12-15 17:25:01,"Strange, couldn't find a menu online so I called to find out bulk sizes for wing orders.  Asked about flavors and he said can't go wrong with the buffalo.  I mentioned honey just guessing and he said ""ya ya but you can't go from wit buffalo""

Come to find out later they have several flavors.  Appears he was too lazy to want to make them.",3.6692307692307695,4.0,positive,13
ZD4pn3wsNh1EnXF3GuNQEg,Chicken Holiday,1865 N Olden Avenue Ext,Trenton,NJ,40.249878572,-74.7781056482,XNk4j6Y7DxjKVU0ZS7-Jaw,7kHyIO41McxHnkIYNIsT4w,2020-09-28 23:21:17,"was there tonight
got a simple order of two snacks
wife's was ok but they screwed u my fillet of flounderr snack
got the side wrong
not first time they have screwed up
only go there when my wife want jumbo shrimp snack",3.6692307692307695,2.0,negative,13
ZD4pn3wsNh1EnXF3GuNQEg,Chicken Holiday,1865 N Olden Avenue Ext,Trenton,NJ,40.249878572,-74.7781056482,ilPYTS6HYMVUsP7O5CQAjA,USfovyfryenT69j_tGmI-A,2020-11-11 18:18:16,"I definitely will give Chicken Holiday another chance. I tried to call in my order numerous times and never seemed to get through. I decided maybe their phones were down or maybe the number was outdated. I drove down here to get some chicken and the first thing the guy asks me is ""did you call in an order?"" and when I said ""no"" he said that I'd have to wait 15 min. Which was fine but slightly frustrating when I did attempt to call in an order. I confirmed that the number I was calling was the correct one. 

The food itself was pretty good. Not the best chicken I've ever had but for the price and all things considered it was pretty good!

 I've also heard that other Chicken Holiday locations are better but I can't verify this.",3.6692307692307695,2.4899999999999998,neutral,13
ZD4pn3wsNh1EnXF3GuNQEg,Chicken Holiday,1865 N Olden Avenue Ext,Trenton,NJ,40.249878572,-74.7781056482,nwIsna6-uJ83lAj5xAYeXw,op8PgFWB69d-Xt8L7H54bw,2021-03-12 05:17:26,"We are new in town and have been driving past all week so tonight my family had to try it. We were not disappointed. Everything was so great and the man who took my phone order was awesome and promised some of the best food I've ever had. He wasn't wrong! We tried chicken breasts, chicken fingers, Buffalo wings, mozzarella sticks and ribs. I can't pick a favorite. We will absolutely be back!",3.6692307692307695,5.0,positive,13
ZD4pn3wsNh1EnXF3GuNQEg,Chicken Holiday,1865 N Olden Avenue Ext,Trenton,NJ,40.249878572,-74.7781056482,ye91s_X6msv6KKDokqu6iA,-G7Zkl1wIWBBmD0KRy_sCw,2021-06-15 21:00:42,"Just ordered a 16 piece fried chicken bucket from Chicken Holiday on Olden Avenue Extension in Ewing, NJ. After calling it in, I drove there on my way home, and arrived just as it was coming out of the pressure fryer. It looked dark bronze and the odor of the steam being released went right to my head, and made me feel a bit intoxicated. 

Nothing wrong with that!

I watched as the cook removed the chicken and transferred it to an aluminum tray for safe travel. I counted the pieces with him, and think my package carried 17 total. I appreciated the extra generosity. He then wrapped the tray in foil, and tore open the top dome to allow the condensation to escape. In turn, that was placed in a heavy gauge brown paper sack, and again split open at the top for additional moisture release. 

By the time I arrived home, I was nearly overcome by the aroma enveloping the car. I decided to sample a wing while still hot and wait for the family before consuming more. First bite encountered crisp skin, followed by warm white meat and a pleasant clean oil fried chicken flavor. I nibbled and sucked all the meat from them bones, and I selfishly considered grabbing a plump breast for a long moment. 

Nah! It would be more fun to indulge with the fam. So, I waited. 

An hour later we were sitting around the kitchen table with sides of homemade mashed potatoes and green salad as excellent complementary pieces to a very happy meal. 

A star is missing because truth be told, the chicken was a tad overdone. A lighter golden copper finish would have made it perfect. Turns out that as much as I love the color bronze, it is past prime when it comes to fried chicken excellence. Still very good texture and taste, but with a subtle aftertaste that missed the mark. 

In fried chicken, even a seconds can make a big difference.",3.6692307692307695,3.32,neutral,13
__2LkeVwTuKar5AE95Idzw,McDonald's,11007 Bloomingdale Ave,Riverview,FL,27.8931987958,-82.3198442906,6wWutd3TBE3FFEP4j0SntA,Fa2-VD8cqcn98vqciVn3Gw,2014-08-16 14:20:52,"Open 24 hours, and next to a sketchy 7-11.  As with all McDonald's, you get what you pay for.  ""Meat"" and HFCS at any time, day or night.",1.4361538461538463,1.6,negative,13
__2LkeVwTuKar5AE95Idzw,McDonald's,11007 Bloomingdale Ave,Riverview,FL,27.8931987958,-82.3198442906,jY_aWoMiP76B8gqzyR06LA,VwhG3Clsq8-2XKSDWeI1pQ,2016-01-31 15:11:55,"Awful service... ALWAYS the wrong order. How many untrained, non-caring employees can one location hire. Every order is missing items. Maybe that is the plan, save money by not filling the entire order knowing that once someone drives away they very likely wont return to get the food. How much can one location save in a year by shorting every order just a few bucks. As a corporation knowing this location is in an affluent area you would think they would step up the surveillance and correct the problems. Avoid this location!!!!",1.4361538461538463,1.0,negative,13
__2LkeVwTuKar5AE95Idzw,McDonald's,11007 Bloomingdale Ave,Riverview,FL,27.8931987958,-82.3198442906,2Yg6tz52Z52f6fVVGi_IUg,JScv11NGg7-tsJ7qnwmgRA,2016-02-22 01:18:38,"Ok so I just relocated to this area and its walking distance from home. I like to take my kids for a walk and get a ice cream and food sometimes. Well they were on a roll with getting my order correct finally someone understood what ""NO CHEESE"" was. Well this last time I went my order was wrong and I let the worker know and she apologized and let the kitchen know. They redid my burger but again put cheese. I let her know again and as in standing there the kitchen manager said ""its wrong again? Ugh make her wait"" mind you I am standing at the counter. So about 3-4 min later I finally get my burger. The lady who took my order apologized and said have a great day but what she forgot were my ice creams I had also ordered. Mind you I was already at the counter and waiting for my complete order for about 10min now. I was supper annoyed by that point and most likely went be returning.",1.4361538461538463,2.0,negative,13
__2LkeVwTuKar5AE95Idzw,McDonald's,11007 Bloomingdale Ave,Riverview,FL,27.8931987958,-82.3198442906,Rg01Osiv9_nHH1zz2DzhNg,Fhx8XmwP_mNONpbph56QCQ,2017-07-11 17:33:23,"OMG.
Slowest McDonald's I have ever visited.
Staff was milling around like the Walking Dead in slo mo - truly don't know how a person can move that slowly!",1.4361538461538463,1.0,negative,13
__2LkeVwTuKar5AE95Idzw,McDonald's,11007 Bloomingdale Ave,Riverview,FL,27.8931987958,-82.3198442906,cJOMEYe7nWbmzB2ifjyaWg,_f_6aQqbOQH7ui80Btz_hw,2018-03-29 18:42:01,We went into this McDonald's with my family and they had us use the kiosk. We waited about 20 min and saw our number was not even listed. We asked and they said it never went through to them but we were charged for it. So they put it in the system and it took another 15 min to get our food. We had it all to go. We got in the car and started handing out food and ended up with a whole extra bag of food that wasn't ours! Get it together McDonald's,1.4361538461538463,1.0,negative,13
__2LkeVwTuKar5AE95Idzw,McDonald's,11007 Bloomingdale Ave,Riverview,FL,27.8931987958,-82.3198442906,6p4xuS9xtePJZmXWOA2Zpg,ya-4qEfSWcSGR0uHOo1CqA,2019-03-30 15:15:12,"This is the worst McDonalds ever. The staff, especially Cici (The Manager) She was very rude to us after we complained about pretty much everything, considering everything was messed up. It took over 25 minutes to get our food. I went up to the counter and complained about it and she said that she called us 10 minutes ago but no one heard anything. Once we got the food, it was cold and my friends order was messed up, and his dad never got his coffee, he complained about that and Cici was arrogant and said we placed a to-go order when we got a table number and the reciept never said that it was a 
to-go order. also when she kicked us out she said to leave the food, that we paid for, at the table and she called the cops on us for nothing. instead of owning up to her mistakes she pointed the finger at us she blamed everything on us and didn't even apologize to us. there was also a person next to us that had a similar experience and he left the building fuming and didn't even get the coffee he paid for. luckily there is a wendy's next door, i know who will be getting my future business",1.4361538461538463,1.0,negative,13
__2LkeVwTuKar5AE95Idzw,McDonald's,11007 Bloomingdale Ave,Riverview,FL,27.8931987958,-82.3198442906,4IksjDlgaf0YFwoA4WhGKg,ZxNQxFsN4FoGLbrmyrk0fQ,2019-10-09 00:04:13,Ordered here through DoorDash. The burgers were all undercooked and almost raw. Buns were actually bloody on two of them. When we called to let them know they hung up on us.,1.4361538461538463,1.0,negative,13
__2LkeVwTuKar5AE95Idzw,McDonald's,11007 Bloomingdale Ave,Riverview,FL,27.8931987958,-82.3198442906,f3427lmR8gXfjXkoLdIGNQ,7Euh30ulJ4ZjqLh9QH5MZQ,2020-02-19 21:19:29,"So i stopped in at 10:40 to get a 2 for 4 breakfast,  i ordered the sandwiches and the woman manager said oh u ordered the sausage and the special is only with bacon, like i care what meat. It cost me 9.80 with a bottle water, really?? Also it says breakfast, well the sign does not have hours posted on it....so ten minutes past 10:30? I walked away pissed, the manager should have given me the sale price or got me the one with bacon. Terrible customer service. D, i frequent this Md all the time.",1.4361538461538463,1.0,negative,13
__2LkeVwTuKar5AE95Idzw,McDonald's,11007 Bloomingdale Ave,Riverview,FL,27.8931987958,-82.3198442906,jed3-Jl3uAlV9XnqwMCUBQ,t6fyh47e41h51q8cGnb0GA,2020-07-01 21:35:24,"Granted it is fast food, but you've worked hard and now you are hungry and you expect it to be what you've ordered. I'm not sure why it is so hard to get the order right. I have been to the McDonald's 4 to 5 times in the last month and it each time something is WRONG. I'm done!!! There are other fast food chains in the area.",1.4361538461538463,1.0,negative,13
__2LkeVwTuKar5AE95Idzw,McDonald's,11007 Bloomingdale Ave,Riverview,FL,27.8931987958,-82.3198442906,avyMqV063pJaQ6p7qLCqnQ,bhT50kYUw3ONRI5vdDkvUw,2021-01-06 01:36:19,"I've only had good experiences at this franchise so far! Food is usually hot/warm and I have not experienced any food poisoning like at another McDonald's I used to go to.
Customer service is okay. It's not bad but it's not exceptional. I frequent the drivethru only since the pandemic.",1.4361538461538463,3.07,neutral,13
__2LkeVwTuKar5AE95Idzw,McDonald's,11007 Bloomingdale Ave,Riverview,FL,27.8931987958,-82.3198442906,r9Qx2W6WNlAlhq1HdA0J6g,gyc4NxDpZkWTJvZF8sanFA,2021-03-06 15:36:26,"We were waiting in line from 10:23 to 10:28. We pull up and the menu is still breakfast (duh because they stop serving at 10:30). We proceed to order and she informs us that now they're serving lunch. We say how it's not 10:30 and the MENU even still says breakfast, what do they do? Change it while we're in line lol not the first time we've had this problem at this location",1.4361538461538463,1.0,negative,13
__2LkeVwTuKar5AE95Idzw,McDonald's,11007 Bloomingdale Ave,Riverview,FL,27.8931987958,-82.3198442906,V-ptDASkcmQMHLVGMr64Xg,70zr9LmyugDHdoOvpssebw,2021-05-03 23:08:53,We never receive the toy for the happy meal that is advertised. Always get some toy that they had like a year ago. They need to get it together with whoever is in charge of inventory. Kid is always disappointed.,1.4361538461538463,3.0,neutral,13
__2LkeVwTuKar5AE95Idzw,McDonald's,11007 Bloomingdale Ave,Riverview,FL,27.8931987958,-82.3198442906,eLgm0bJ7ZFI_ldHiSQYknQ,cRt-4fFrMQ2ZZWFpF0gKgw,2021-11-05 21:23:34,asked for only onions on my burgers and only got ketchup! gave me water instead of sprite!,1.4361538461538463,1.0,negative,13
kvt7lGaRArkeDbw5eCZP8w,Mr. Eds seafood and oyster Bar,"941 Iberville St, Ste 100",New Orleans,LA,29.9549911951,-90.0693310797,HsjjNxjEs0aRUzIaI7bpww,-Yifkg9JbiHDn68K8M7Lvw,2018-12-09 14:03:41,"Brand new location. Brand new menu items. Same great service you expect from Mr Ed's Seafood and Oyster Bar NOW OPEN at 821 Iberville in the heart of the French Quarter. Fantastic menu options like Oysters on the half shell, Oyster Rockefeller, jumbo friend shrimp or fish, and Crawfish & Crab Cakes, just to name a few.  Save room for dessert,  but with options like Banna Fosters Creme Pie, Bread Pudding, and Chocolate Mousse, it's almost impossible to decide.  It's a casual, family friendly restaurant, open 11am-10pm  Sun-Thurs, 11am-11pm Fri. & Sat (subject to change).
You'll appreciate the large selection of local beers on tap, and their custom mixed cocktails are always on point. My favorite is Debbie's Fruit Punch, you've got to check it out. 
It's seriously good.",3.436923076923077,5.0,positive,13
kvt7lGaRArkeDbw5eCZP8w,Mr. Eds seafood and oyster Bar,"941 Iberville St, Ste 100",New Orleans,LA,29.9549911951,-90.0693310797,3IyoKqmhZZkiXRcx4ZTYxQ,akT7Z_rKAfcBISmGCmWCjg,2019-02-04 16:11:14,Chips are okay. Cold water. Spinach artichoke dip was good. Those were the positives.,3.436923076923077,1.0,negative,13
kvt7lGaRArkeDbw5eCZP8w,Mr. Eds seafood and oyster Bar,"941 Iberville St, Ste 100",New Orleans,LA,29.9549911951,-90.0693310797,ZT7p1yhQT3cRJU2E4tAPtQ,1h4poa0l9rsSeMMIHR3Ljw,2019-02-08 01:51:04,"Walked in by accident. Had great service! Our server, Cassie recommended the blackened alligator appetizer and it was fantastic!",3.436923076923077,3.3099999999999996,neutral,13
kvt7lGaRArkeDbw5eCZP8w,Mr. Eds seafood and oyster Bar,"941 Iberville St, Ste 100",New Orleans,LA,29.9549911951,-90.0693310797,KdMsF0wE6U9lWEcfrnNuFQ,-QYLYzyOXd-1qM4lBypNng,2019-03-13 20:49:08,"These are the best oysters I've ever had! The service was good and all of the food was good. We are the red beans and rice, char grilled oysters, fried fish, barbecue shrimp, and fried shrimp. It was a  very good restaurant overall would recommend.",3.436923076923077,5.0,positive,13
kvt7lGaRArkeDbw5eCZP8w,Mr. Eds seafood and oyster Bar,"941 Iberville St, Ste 100",New Orleans,LA,29.9549911951,-90.0693310797,o4I8YROfiKHeKeO_sqoiBg,C-W8bletTRIL9c_c2uAahA,2019-04-01 22:59:53,"The food was delicious!  The problem is the service!

First the good:  It was super fresh & everyone enjoyed their meals. We had the alligator appetizer, Shrimp Po Boy, Shrimp & Grits, & the Creole Sampler.  No complaints on any of them. We also had the Charbroiled Oysters, Yum!  The bar drinks were also really tasty & strong.

Where the visit fell apart is service.  Our waiter, Dominque , was just plain HORRIBLE!  He took drink orders & appetizer at the same time.  We received the appetizer but no sign of any of the drinks bar or non-bar.  He finally came back with part of the drinks.  I asked about the missing drink which he said was coming.  We then watched him go back over & enter the order.  It then sat & sat on the bar waiting for him to return.
The food runner brought out the order & made sure it was correct.  The waiter finally returned with the bar drink.  All glasses were empty but no refills offered.  I stopped him & asked for additional Dr Pepper & Diet Coke.  They never came.  He likewise did not return until he dropped off the check never asking how things were, desserts, etc.  the buser has came by & cleared all plates, etc.  the buser like the food runner checked on the meal & asked if we'd consider eating there again.

I would still have only taken off 1 star had I not overheard the hostess tell someone who was on waitlist "" people complain about service but they have 10 tables each"". This tells me it isn't an isolated issue. I waited tables for over 8 years.  I understand bad nights but this was just extreme.",3.436923076923077,3.0,neutral,13
kvt7lGaRArkeDbw5eCZP8w,Mr. Eds seafood and oyster Bar,"941 Iberville St, Ste 100",New Orleans,LA,29.9549911951,-90.0693310797,jkp5-DvdcP8KLXB_pvYxGA,L2IRqWK-SoSVinWYTOscxw,2019-04-21 21:27:36,This place was amazing and the service was exceptional. It's very kid friendly and the kids menu was great. It wasn't expensive and the service people were very nice and professional,3.436923076923077,5.0,positive,13
kvt7lGaRArkeDbw5eCZP8w,Mr. Eds seafood and oyster Bar,"941 Iberville St, Ste 100",New Orleans,LA,29.9549911951,-90.0693310797,j14V15Pkevva-8YBJcwMhQ,4ttENll9imWTv2dHghkz_g,2019-05-20 23:15:39,We were in the neighborhood exploring New Orleans and decided to stop in. This is just a basic seafood place so do not expect anything over the top.  Everything was good but a bit heavy on the butter and salt which is typical New Orleans. Prices were fair for what you got. This seems to be is a place for locals.,3.436923076923077,3.0,neutral,13
kvt7lGaRArkeDbw5eCZP8w,Mr. Eds seafood and oyster Bar,"941 Iberville St, Ste 100",New Orleans,LA,29.9549911951,-90.0693310797,dGjxhsFD1_WoFIMcGZP-Yg,S3J3Z_MyuH7ZbaTPuowiug,2019-06-24 13:55:17,"Sheila was our server!  What this means is we had Excellent Kind Service! She took Great care of us! 
She servers me my First Hurricane! 

Grilled Oysters here are Wicked delicious! Be warned tho the shells are scorching hot! 
Seafood pastries are to die for as well!  

No complaints about our Entrees. I would give details and maybe even post pictures except I had a second hurricane and well I don't really remember what we ate ! I had some sort of trifecta.  Beans and rice, jambalaya and at Étouffée. Partners food was devoured luckily split with out a trace! He's very particular about food so the empty plate spoke volumes! Five Stars!!! Thank you Miss Sheila!!!",3.436923076923077,3.91,neutral,13
kvt7lGaRArkeDbw5eCZP8w,Mr. Eds seafood and oyster Bar,"941 Iberville St, Ste 100",New Orleans,LA,29.9549911951,-90.0693310797,li-UyzSpKkBZY2lUbvy5Fg,WNeYsde8OH-M2h25W17eTg,2019-07-10 21:38:28,"Horrible service horrible food absolutely horrible experience 
Wish I could give it no stars",3.436923076923077,1.0,negative,13
kvt7lGaRArkeDbw5eCZP8w,Mr. Eds seafood and oyster Bar,"941 Iberville St, Ste 100",New Orleans,LA,29.9549911951,-90.0693310797,KNZ13lWoMKvaADwgxNfJbw,5T_CyRFryfD2TMBIp-e8Gw,2019-08-10 02:07:48,We had an absolutely incredible experience here! The food was amazing! Elishia was our server and she was awesome! Next time we are in NOLA this will be a MUST stop!,3.436923076923077,5.0,positive,13
kvt7lGaRArkeDbw5eCZP8w,Mr. Eds seafood and oyster Bar,"941 Iberville St, Ste 100",New Orleans,LA,29.9549911951,-90.0693310797,GoS7XSrhhOEfamajXaje0Q,CtntBqqLGk9ULU_RtVBIWQ,2019-09-14 15:42:48,I have the crab cakes and they were probably worst I've ever had in a so called authentic Cajun restaurant. The jambalaya was also sub par. The wait staff was very attentive but towards the end of the evening and after closing time our party spotted several mice running through the restaurant. The staff attempted to explain it away by stating that it's a problem for all restaurants in the Quarter. No bill compensation... No apologies... Will never return!,3.436923076923077,1.0,negative,13
kvt7lGaRArkeDbw5eCZP8w,Mr. Eds seafood and oyster Bar,"941 Iberville St, Ste 100",New Orleans,LA,29.9549911951,-90.0693310797,2DZdWhpIXBSDcNwEpjnYMA,y9ZAakn30v9u6463pf356Q,2019-09-16 21:35:46,"My best friend and I were told about this place on our arrival and managed to try it for breakfast this morning, the food and the service was absolutely amazing!!!! Some of the best shrimp and grits I've ever had in my life, the red beans and rice is also to die for... you will never be disappointed. Major shout out to AJ our server who was absolutely amazing and made our choose so worth it! Thanks AJ xoxox see you next time... ""island girls""",3.436923076923077,5.0,positive,13
kvt7lGaRArkeDbw5eCZP8w,Mr. Eds seafood and oyster Bar,"941 Iberville St, Ste 100",New Orleans,LA,29.9549911951,-90.0693310797,h-xHJkNHnj7V0xAkRIhMNg,Ekw7wuUTX36BtcPP6XnA-Q,2019-10-14 01:08:07,"I have been to Mr Ed's other locations and was very happy to hear that they opened up another location closer to where I usually stay.  It's still finding its identity but I am happy to patronize.  My favorites étouffée and chargrilled oysters are on par with the other locations.  

Service is good and it had a nice decor.  I hope that this location continues to grow.  I would highly recommend coming here.",3.436923076923077,3.46,neutral,13
pzclcGZd0fZmLb9R8SNdbA,Wawa,200 Forty Foot Rd,Hatfield,PA,40.2631115649,-75.3204873287,nu7RZrz_yDWrzaIwCrERrg,qubY1K71GWDWbQjTOxGz2w,2012-09-04 14:12:18,"Great gas prices here (even for Lansdale, which has some of the cheapest gas prices in the local region).  I get  some every time we visit our friends near by.",2.883076923076923,3.35,neutral,13
pzclcGZd0fZmLb9R8SNdbA,Wawa,200 Forty Foot Rd,Hatfield,PA,40.2631115649,-75.3204873287,v-QzHFNzvHAG5n_7p5JbwQ,H22Rt7T0cHGaWfjZqEfGkQ,2013-02-19 03:02:54,"I gotta have my refill... of gas and coffee every morning.  On occasion I spurge for a breakfast hoagie which really hits the spot. 

However, this spot is is not as good as most other Wawas.  Something about the way they do things here seems slower.",2.883076923076923,2.35,neutral,13
pzclcGZd0fZmLb9R8SNdbA,Wawa,200 Forty Foot Rd,Hatfield,PA,40.2631115649,-75.3204873287,UowBtdsJMQH_F9H0Bcb2_A,Uu1kGMIFSrkiyU6SQwAouQ,2014-06-15 22:10:41,Awesome place... Low prices High Quality and great service!!! Their breakfast and lunch sandwiches are the best I have tried so far!! Love Wawa Personly very much,2.883076923076923,5.0,positive,13
pzclcGZd0fZmLb9R8SNdbA,Wawa,200 Forty Foot Rd,Hatfield,PA,40.2631115649,-75.3204873287,Y-NZgAXwi10Q7es_MMInTA,F67Yprv2Gj_UUKrd57LJ0g,2014-07-18 00:06:39,"I love Wawa, but not this location. I got sick from their Tuna Hoagie, and got upset stomach from other things I've ordered from them. I am thinking their food safety is not up to par. The location on 309 in Colmar is better. Drive there if you need your WaWa fill. Hope they clean up their act.",2.883076923076923,1.0,negative,13
pzclcGZd0fZmLb9R8SNdbA,Wawa,200 Forty Foot Rd,Hatfield,PA,40.2631115649,-75.3204873287,mDxIga8XlcfxKw992S5dwA,nkBpODDjnP-nD9uz1Z4YsA,2014-12-07 16:35:53,"A few miles away from me, but this is my first choice with the Wawa at the corner of 40 Foot and Sumneytown not being very consistent with their product.  This is where my wife and I go for gas on most occasions because they have the best prices around.  Great location between Shoprite, Lowes, and Chick-fil-A.  Very clean store.  Busy, but not inconvenient.  Glad it's in my area.  Didn't have a nice Wawa close by where we just moved from.",2.883076923076923,3.39,neutral,13
pzclcGZd0fZmLb9R8SNdbA,Wawa,200 Forty Foot Rd,Hatfield,PA,40.2631115649,-75.3204873287,AiqEFUKAuBRfO8cuP2gC2g,Vbq3eLE1QXsXXLn0NXe1dg,2015-08-05 18:17:49,"Review of this location.  Dirtiest Wawa I have been in.  Stopped in for coffee before getting on turnpike,  infested with flies and floors were a mess.  Flies were all over the sizzlis in the warmer and  sitting on the coffee urns. I left.  Then contacted board of health.",2.883076923076923,1.19,negative,13
pzclcGZd0fZmLb9R8SNdbA,Wawa,200 Forty Foot Rd,Hatfield,PA,40.2631115649,-75.3204873287,UV-DMotKRFTej9HpVK6whw,O_8dLcm-JMcW6k68bANFog,2016-05-29 22:05:49,Very busy Wawa but always good food.  Love their food.  Inconsistent when it comes to their lattes. Sometimes they taste awful and sometimes are better than Starbucks.,2.883076923076923,4.09,positive,13
pzclcGZd0fZmLb9R8SNdbA,Wawa,200 Forty Foot Rd,Hatfield,PA,40.2631115649,-75.3204873287,rNDPO_-Ehk36cU2aKMHNGQ,Wuuh91oV5A5UjTgoFzhv6w,2016-10-10 20:58:14,Clean gas station and staff always seems lively and upbeat. I love going for a wawa run for their coffees but their gas prices are higher than other gas stations. This location always seems busy.,2.883076923076923,3.78,neutral,13
